{
  "id": "review.laura.southern-abrasives-opportunity",
  "trigger_id": "trigger.laura.southern-abrasives-opportunity",
  "created_at": "2026-04-28T16:10:00Z",
  "status": "pending_approval",
  "summary": "Laura can draft internal marketing material from the won deal, but external LinkedIn publication requires approval and fresh evidence.",
  "journal_entry_refs": [],
  "memory_entry_refs": [],
  "rollup_requests": [
    {
      "state_object_id": "state.operating_picture.marketing",
      "reason": "A won deal may affect marketing proof points and campaign opportunities."
    }
  ],
  "follow_up_refs": [
    "action.laura.southern-abrasives-internal-proof-note",
    "approval.laura.southern-abrasives-linkedin-publication"
  ]
}
